commit	branch	cv_mae_usd	cv_rmse_usd	status	description
abf6a85	auto-ml/mar25	13268.957301	16166.265898	keep	baseline train.py
c32c738	auto-ml/mar25	13268.542290	16161.715893	keep	more features (100) + tuned lr=0.05 max_iter=500
d0ea75a	auto-ml/mar25	13262.540292	16151.126602	keep	experience^2 + country target encoding
da00ebb	auto-ml/mar25	13268.296010	16160.234742	discard	more target encodings + interactions (overfit)
bb4197c	auto-ml/mar25	13259.011209	16146.619627	keep	exp2 features + lr=0.03 max_iter=1000 l2=0.1
37a7017	auto-ml/mar25	13263.355320	16153.169519	discard	lr=0.02 max_iter=2000 (too slow)
ef06c80	auto-ml/mar25	49044.622253	59660.063849	crash	N_SPLITS=10 causes major regression
5c2abb1	auto-ml/mar25	13288.242795	16193.787564	discard	max_leaf_nodes=63 no max_depth
d37e59c	auto-ml/mar25	13259.325861	16146.509394	keep	min_samples_leaf=10 (near-best)
f597b21	auto-ml/mar25	13259.011209	16146.619627	discard	log1p(exp) + total_skills + bayesian TE (same as best)
bff36fd	auto-ml/mar25	13258.057870	16150.040944	keep	HGBR native categorical features (new best)
46e7624	auto-ml/mar25	13258.993053	16150.940446	discard	native cats + country TE (redundant, slightly worse)
e1ba96b	auto-ml/mar25	13254.686803	16145.619019	keep	native cats + l2=0.05 (new best)
6ee0ce6	auto-ml/mar25	13254.686803	16145.619019	discard	hyperparameter search (l2 lr leaf vocab) -- best config confirmed
a4e29ae	auto-ml/mar25	13256.745613	16150.594437	discard	ordered enc + monotonic + exp_bin + drop-exp2 (worse)
7c84269	auto-ml/mar25	13251.530038	16137.254944	keep	3-seed ensemble per fold (new best)
a173937	auto-ml/mar25	13249.902513	16136.378731	keep	5-seed ensemble (new best)
77cc144	auto-ml/mar25	13249.889766	16135.335678	keep	10-seed ensemble (marginal improvement)
0b2e889	auto-ml/mar25	13244.154687	16130.551852	keep	repeated 2-KFold x 5-seed ensemble (new best)
764a91f	auto-ml/mar25	13240.192274	16123.101719	keep	3-KFold seeds x 5-seed ensemble (new best)
3a71f21	auto-ml/mar25	13238.092446	16120.155592	keep	4-KFold seeds x 5-seed ensemble (new best)
3a71f21	auto-ml/mar25	13238.437701	16119.193732	discard	5-KFold seeds (marginal regression -- 4 is optimal)
3a71f21	auto-ml/mar25	13238.740874	16120.758526	discard	7 model seeds (worse than 5 -- reverted)
3a71f21	auto-ml/mar25	13239.613149	16120.350295	discard	N_SPLITS=7 (slightly worse than 5)
3a71f21	auto-ml/mar25	13278.349803	16185.060810	discard	max_leaf_nodes=None with max_depth=7 (overfit)
3a71f21	auto-ml/mar25	13366.680954	16322.341593	discard	HGBR+ExtraTrees blend (ET poor fit on binary features)
3a71f21	auto-ml/mar25	13238.272261	16119.710521	discard	mixed depth ensemble (6,7,8) -- no gain over depth=7
3abeb09	auto-ml/mar25	13236.099323	16112.329482	keep	QuantileTransformer target -- normal dist (new best)
